{
    "title": "Services | Piel en Armonia",
    "description": "Dermatology catalog with filters by category, intent, and audience, plus booking continuity.",
    "hero": {
        "eyebrow": "Program catalogue",
        "title": "A service hub treated like a clinical portfolio.",
        "deck": "Browse clinical dermatology, medical aesthetics, and pediatrics with stricter hierarchy, less noise, and clearer entry points.",
        "tone": "ink",
        "media": "/images/optimized/showcase-hero.webp",
        "mediaMeta": {
            "src": "/images/optimized/showcase-hero.webp",
            "alt": "Dermatology program catalogue",
            "kind": "image"
        }
    },
    "telemedicine": {
        "eyebrow": "Care mode",
        "title": "Telemedicine belongs to the same system, not to a decorative subpage.",
        "deck": "Start remotely when the case fits and escalate to the clinic when evaluation or procedure requires it.",
        "href": "/en/telemedicine/",
        "tone": "porcelain"
    },
    "booking": {
        "eyebrow": "Booking bridge",
        "title": "Each program can fall into booking with visible operational trust.",
        "deck": "Each CTA keeps service context and aligns pricing, tax, policy, and support in a single flow.",
        "actionLabel": "Open booking",
        "serviceHint": "consulta",
        "tone": "silver"
    }
}
